{
  "$schema": "../../schemas/nam-pack-manifest.schema.json",
  "gear": {
    "make": "Vox AC30HWH",
    "model": "Vox AC30HWH",
    "notes": "Public page notes: retubed with JJ tubes, master volume bypassed; Normal channel bright switch on; Top Boost treble and bass at noon; Hot Mode; optional Top Cut at 6/10."
  },
  "model_policy": {
    "architecture_version": "2",
    "format": "nam-a2",
    "gear_type": "amp-head",
    "includes_cab": false,
    "ir_policy": "amp-head-plus-greybound-ir"
  },
  "models": [
    {
      "architecture": "SlimmableContainer",
      "gain": 0.8105402731546868,
      "loudness": -10.558403968811035,
      "metadata_name": "HotMode-Gain5-TopCut",
      "name": "HotMode-Gain5-TopCut",
      "path": "AC30HWH/HotMode-Gain5-TopCut.nam",
      "priority": false,
      "recommended_latency_samples": 10,
      "sample_rate_hz": 48000,
      "semantics": {
        "channel": "HotMode",
        "gain_label": "5",
        "gain_position": 5,
        "hot_mode": true,
        "top_cut_enabled": true,
        "top_cut_position": 6
      },
      "size_bytes": 294124,
      "validation_esr": 0.01296285004128025,
      "version": "0.7.0"
    },
    {
      "architecture": "SlimmableContainer",
      "gain": 0.8127190263818107,
      "loudness": -10.568947792053223,
      "metadata_name": "HotMode-Gain5",
      "name": "HotMode-Gain5",
      "path": "AC30HWH/HotMode-Gain5.nam",
      "priority": false,
      "recommended_latency_samples": 10,
      "sample_rate_hz": 48000,
      "semantics": {
        "channel": "HotMode",
        "gain_label": "5",
        "gain_position": 5,
        "hot_mode": true,
        "top_cut_enabled": false,
        "top_cut_position": null
      },
      "size_bytes": 294378,
      "validation_esr": 0.011607043657077635,
      "version": "0.7.0"
    },
    {
      "architecture": "SlimmableContainer",
      "gain": 0.819162510412665,
      "loudness": -10.64424991607666,
      "metadata_name": "HotMode-Gain7-TopCut",
      "name": "HotMode-Gain7-TopCut",
      "path": "AC30HWH/HotMode-Gain7-TopCut.nam",
      "priority": false,
      "recommended_latency_samples": 10,
      "sample_rate_hz": 48000,
      "semantics": {
        "channel": "HotMode",
        "gain_label": "7",
        "gain_position": 7,
        "hot_mode": true,
        "top_cut_enabled": true,
        "top_cut_position": 6
      },
      "size_bytes": 294063,
      "validation_esr": 0.024180700360618354,
      "version": "0.7.0"
    },
    {
      "architecture": "SlimmableContainer",
      "gain": 0.8130235466771593,
      "loudness": -10.601553916931152,
      "metadata_name": "HotMode-Gain7",
      "name": "HotMode-Gain7",
      "path": "AC30HWH/HotMode-Gain7.nam",
      "priority": false,
      "recommended_latency_samples": 10,
      "sample_rate_hz": 48000,
      "semantics": {
        "channel": "HotMode",
        "gain_label": "7",
        "gain_position": 7,
        "hot_mode": true,
        "top_cut_enabled": false,
        "top_cut_position": null
      },
      "size_bytes": 294165,
      "validation_esr": 0.02094310975308524,
      "version": "0.7.0"
    },
    {
      "architecture": "SlimmableContainer",
      "gain": 0.851599894884847,
      "loudness": -10.97376823425293,
      "metadata_name": "HotMode-Gain10-TopCut",
      "name": "HotMode-GainFull-TopCut",
      "path": "AC30HWH/HotMode-GainFull-TopCut.nam",
      "priority": false,
      "recommended_latency_samples": 10,
      "sample_rate_hz": 48000,
      "semantics": {
        "channel": "HotMode",
        "gain_label": "Full",
        "gain_position": 10,
        "hot_mode": true,
        "top_cut_enabled": true,
        "top_cut_position": 6
      },
      "size_bytes": 293853,
      "validation_esr": 0.029561031841963525,
      "version": "0.7.0"
    },
    {
      "architecture": "SlimmableContainer",
      "gain": 0.8529928775003858,
      "loudness": -10.841939926147461,
      "metadata_name": "HotMode-Gain10",
      "name": "HotMode-GainFull",
      "path": "AC30HWH/HotMode-GainFull.nam",
      "priority": false,
      "recommended_latency_samples": 10,
      "sample_rate_hz": 48000,
      "semantics": {
        "channel": "HotMode",
        "gain_label": "Full",
        "gain_position": 10,
        "hot_mode": true,
        "top_cut_enabled": false,
        "top_cut_position": null
      },
      "size_bytes": 293670,
      "validation_esr": 0.026950783300737295,
      "version": "0.7.0"
    },
    {
      "architecture": "SlimmableContainer",
      "gain": 0.3527697700306384,
      "loudness": -12.2893705368042,
      "metadata_name": "V3-TC",
      "name": "Normal-Bright-Gain3-TopCut",
      "path": "AC30HWH/Normal-Bright-Gain3-TopCut.nam",
      "priority": false,
      "recommended_latency_samples": 15,
      "sample_rate_hz": 48000,
      "semantics": {
        "bright_switch": true,
        "channel": "Normal-Bright",
        "gain_label": "3",
        "gain_position": 3,
        "top_cut_enabled": true,
        "top_cut_position": 6
      },
      "size_bytes": 295887,
      "validation_esr": 0.0008963995535978177,
      "version": "0.7.0"
    },
    {
      "architecture": "SlimmableContainer",
      "gain": 0.5211069722544068,
      "loudness": -11.592336654663086,
      "metadata_name": "V3",
      "name": "Normal-Bright-Gain3",
      "path": "AC30HWH/Normal-Bright-Gain3.nam",
      "priority": false,
      "recommended_latency_samples": 13,
      "sample_rate_hz": 48000,
      "semantics": {
        "bright_switch": true,
        "channel": "Normal-Bright",
        "gain_label": "3",
        "gain_position": 3,
        "top_cut_enabled": false,
        "top_cut_position": null
      },
      "size_bytes": 295699,
      "validation_esr": 0.0011314371602081494,
      "version": "0.7.0"
    },
    {
      "architecture": "SlimmableContainer",
      "gain": 0.6652923435193837,
      "loudness": -10.809303283691406,
      "metadata_name": "V5-TC",
      "name": "Normal-Bright-Gain5-TopCut",
      "path": "AC30HWH/Normal-Bright-Gain5-TopCut.nam",
      "priority": false,
      "recommended_latency_samples": 9,
      "sample_rate_hz": 48000,
      "semantics": {
        "bright_switch": true,
        "channel": "Normal-Bright",
        "gain_label": "5",
        "gain_position": 5,
        "top_cut_enabled": true,
        "top_cut_position": 6
      },
      "size_bytes": 295281,
      "validation_esr": 0.0038010453649656517,
      "version": "0.7.0"
    },
    {
      "architecture": "SlimmableContainer",
      "gain": 0.7009037995572707,
      "loudness": -10.849477767944336,
      "metadata_name": "V5",
      "name": "Normal-Bright-Gain5",
      "path": "AC30HWH/Normal-Bright-Gain5.nam",
      "priority": false,
      "recommended_latency_samples": 13,
      "sample_rate_hz": 48000,
      "semantics": {
        "bright_switch": true,
        "channel": "Normal-Bright",
        "gain_label": "5",
        "gain_position": 5,
        "top_cut_enabled": false,
        "top_cut_position": null
      },
      "size_bytes": 294935,
      "validation_esr": 0.003853832865216878,
      "version": "0.7.0"
    },
    {
      "architecture": "SlimmableContainer",
      "gain": 0.7376982753624027,
      "loudness": -10.539884567260742,
      "metadata_name": "V7-TC",
      "name": "Normal-Bright-Gain7-TopCut",
      "path": "AC30HWH/Normal-Bright-Gain7-TopCut.nam",
      "priority": false,
      "recommended_latency_samples": 9,
      "sample_rate_hz": 48000,
      "semantics": {
        "bright_switch": true,
        "channel": "Normal-Bright",
        "gain_label": "7",
        "gain_position": 7,
        "top_cut_enabled": true,
        "top_cut_position": 6
      },
      "size_bytes": 294455,
      "validation_esr": 0.0060989871779789625,
      "version": "0.7.0"
    },
    {
      "architecture": "SlimmableContainer",
      "gain": 0.760041067419794,
      "loudness": -10.62460994720459,
      "metadata_name": "V7",
      "name": "Normal-Bright-Gain7",
      "path": "AC30HWH/Normal-Bright-Gain7.nam",
      "priority": false,
      "recommended_latency_samples": 10,
      "sample_rate_hz": 48000,
      "semantics": {
        "bright_switch": true,
        "channel": "Normal-Bright",
        "gain_label": "7",
        "gain_position": 7,
        "top_cut_enabled": false,
        "top_cut_position": null
      },
      "size_bytes": 294674,
      "validation_esr": 0.006467382339652084,
      "version": "0.7.0"
    },
    {
      "architecture": "SlimmableContainer",
      "gain": 0.7865538319334371,
      "loudness": -10.992156028747559,
      "metadata_name": "V10-TC",
      "name": "Normal-Bright-GainFull-TopCut",
      "path": "AC30HWH/Normal-Bright-GainFull-TopCut.nam",
      "priority": false,
      "recommended_latency_samples": 9,
      "sample_rate_hz": 48000,
      "semantics": {
        "bright_switch": true,
        "channel": "Normal-Bright",
        "gain_label": "Full",
        "gain_position": 10,
        "top_cut_enabled": true,
        "top_cut_position": 6
      },
      "size_bytes": 294176,
      "validation_esr": 0.009575451568097956,
      "version": "0.7.0"
    },
    {
      "architecture": "SlimmableContainer",
      "gain": 0.7864121646340676,
      "loudness": -10.772076606750488,
      "metadata_name": "V10",
      "name": "Normal-Bright-GainFull",
      "path": "AC30HWH/Normal-Bright-GainFull.nam",
      "priority": false,
      "recommended_latency_samples": 10,
      "sample_rate_hz": 48000,
      "semantics": {
        "bright_switch": true,
        "channel": "Normal-Bright",
        "gain_label": "Full",
        "gain_position": 10,
        "top_cut_enabled": false,
        "top_cut_position": null
      },
      "size_bytes": 294408,
      "validation_esr": 0.010322555404139306,
      "version": "0.7.0"
    },
    {
      "architecture": "SlimmableContainer",
      "gain": 0.4268083089771031,
      "loudness": -11.093672752380371,
      "metadata_name": "TopBoost-Gain3-TopCut",